{
  "id": "sg-test-fixture",
  "title": "Test Fixture Spec Group",
  "prd": {
    "source": "local-file"
  },
  "review_state": "APPROVED",
  "work_state": "PLAN_READY",
  "created_at": "2026-01-01T00:00:00Z",
  "updated_by": "agent",
  "updated_at": "2026-01-01T00:00:00Z",
  "convergence": {
    "spec_complete": true,
    "all_acs_implemented": false,
    "all_tests_passing": false,
    "unifier_passed": false,
    "code_review_passed": false,
    "security_review_passed": false,
    "manual_tests_passed": null,
    "docs_generated": null
  }
}
